<?xml version = "1.0" encoding = "ISO-8859-1"?>

<!DOCTYPE editors SYSTEM "dtds/editors.dtd">

<!--
	In your project use the name 'editors.xml' or 'editores.xml'
-->

<editors>

	<editor name="TextField" url="textEditor.jsp">
		<for-type type="java.lang.String" />
		<for-type type="java.math.BigDecimal" />
		<for-type type="java.math.BigInteger" />
		<for-type type="int" />
		<for-type type="java.lang.Integer" />
		<for-type type="long" />
		<for-type type="java.lang.Long" />
	</editor>

	<editor name="BooleanCheckBox" url="booleanEditor.jsp">
		<formatter class="org.openxava.formatters.BooleanFormatter" />		<for-type type="boolean" />		<for-type type="java.lang.Boolean" />	</editor>	<editor name="DateCalendar" url="dateCalendarEditor.jsp">
		<formatter class="org.openxava.formatters.DateFormatter" />		<for-type type="java.util.Date" />	</editor>

	<editor name="ValidValuesCombo" url="validValuesEditor.jsp">
		<for-valid-values />
	</editor>

	<editor name="ValidValuesRadioButton" url="radioButtonEditor.jsp">
		<property name="horizontal" value="true" />
	</editor>
	<editor name="ValidValuesVerticalRadioButton"
		url="radioButtonEditor.jsp">
		<property name="horizontal" value="true" />
	</editor>
	<editor name="ValidValuesHorizontalRadioButton"
		url="radioButtonEditor.jsp">
		<property name="horizontal" value="true" />
	</editor>

	<editor name="Enum" url="validValuesEditor.jsp">
		<for-type type="java.lang.Enum" />
	</editor>

	<editor name="StringTime" url="textEditor.jsp">
		<formatter class="org.openxava.formatters.StringTimeFormatter" />
		<for-stereotype stereotype="HORA" />
		<for-stereotype stereotype="TIME" />
	</editor>

	<editor name="Timestamp" url="textEditor.jsp">
		<formatter class="org.openxava.formatters.SQLTimeFormatter" />
		<for-type type="java.sql.Time" />
	</editor>

	<editor name="Money" url="moneyEditor.jsp">
		<formatter class="org.openxava.formatters.MoneyFormatter" />
		<for-stereotype stereotype="DINERO" />
		<for-stereotype stereotype="MONEY" />
	</editor>
	
	<editor name="Email" url="textEditor.jsp">
        <for-stereotype stereotype="EMAIL"/>
    </editor>
    
    <editor name="WebURL" url="textEditor.jsp">
        <for-stereotype stereotype="WEBURL"/>
    </editor>
    
	<editor name="Image" url="imageEditor.jsp" format="false">
		<formatter class="org.openxava.formatters.ImageFormatter" />
		<for-stereotype stereotype="FOTO" />
		<for-stereotype stereotype="PHOTO" />
		<for-stereotype stereotype="IMAGEN" />
		<for-stereotype stereotype="IMAGE" />
	</editor>

	<editor name="TextArea" url="textAreaEditor.jsp" frame="true">
		<for-stereotype stereotype="TEXTO_GRANDE" />
		<for-stereotype stereotype="MEMO" />
		<for-stereotype stereotype="TEXT_AREA" />
	</editor>

	<editor name="Label" url="labelEditor.jsp">
		<formatter from-type="true" />
		<for-stereotype stereotype="ETIQUETA" />
		<for-stereotype stereotype="LABEL" />
	</editor>

	<editor name="DateTimeCalendar" url="dateTimeCalendarEditor.jsp">
		<formatter class="org.openxava.formatters.DateTimeFormatter" />
		<for-type type="java.sql.Timestamp" />
		<for-stereotype stereotype="DATETIME" />
		<for-stereotype stereotype="FECHAHORA" />
	</editor>

	<editor name="BoldLabel" url="boldLabelEditor.jsp">
		<for-stereotype stereotype="ETIQUETA_NEGRITA" />
		<for-stereotype stereotype="BOLD_LABEL" />
	</editor>

	<editor name="Gallery" url="galleryEditor.jsp">
		<for-stereotype stereotype="IMAGES_GALLERY" />
		<for-stereotype stereotype="GALERIA_IMAGENES" />
	</editor>

	<editor name="ZeroFilled" url="textEditor.jsp">
		<property name="fillWithZeros" value="true" />
		<for-stereotype stereotype="ZEROS_FILLED" />
		<for-stereotype stereotype="RELLENADO_CON_CEROS" />
	</editor>

	<!-- 
		This steroetype is not for be assigned directly to a property, 
		but it's used internally by OpenXava to render actions inside views.
	-->
	<editor url="actionEditor.jsp">
		<for-stereotype stereotype="__ACTION__" />
	</editor>

	<editor name="HtmlText" url="htmlEditor.jsp" frame="true">
		<for-stereotype stereotype="HTML_TEXT" />
		<for-stereotype stereotype="TEXTO_HTML" />
	</editor>

	<!-- 
	It shows an image localized in /xava/images of your web applications,
	with the patter [prefix][propertyContent].[extesion].
	That is, if the property value is 'RED', it will show the image:
	/xava/images/imageLabel_RED.gif.
	You can see an example in the 'sample' property of Color component 
	in OpenXavaTest.
	-->
	<editor name="ImageLabel" url="imageLabelEditor.jsp">
		<property name="prefix" value="imageLabel_" />
		<property name="extension" value="gif" />
		<formatter from-type="true" />
		<for-stereotype stereotype="IMAGE_LABEL" />
		<for-stereotype stereotype="ETIQUETA_IMAGEN" />
	</editor>

</editors>