<?xml version = "1.0" encoding = "ISO-8859-1"?>

<!DOCTYPE editors SYSTEM "dtds/editors.dtd">

<!--
In your project use the name 'editors.xml' or 'editores.xml'
-->

<editors>

  <editor url="textEditor.jsp"> 
    <for-type type="java.lang.String"/>
    <for-type type="java.math.BigDecimal"/>
    <for-type type="java.math.BigInteger"/>
    <for-type type="int"/>
    <for-type type="java.lang.Integer"/>    
    <for-type type="long"/>
    <for-type type="java.lang.Long"/>    
  </editor>
      <editor url="booleanEditor.jsp">
		<formatter class="org.openxava.formatters.BooleanFormatter"/>      	    <for-type type="boolean"/>    <for-type type="java.lang.Boolean"/>  </editor>        <editor url="dateCalendarEditor.jsp">
	<formatter class="org.openxava.formatters.DateFormatter"/>    <for-type type="java.util.Date"/>  </editor>    
  
  <editor url="validValuesEditor.jsp">
  	<for-valid-values/>
  </editor>
  
  <editor url="validValuesEditor.jsp">
  	<for-type type="java.lang.Enum"/>
  </editor>  
    
  <editor url="textEditor.jsp">
	<formatter class="org.openxava.formatters.StringTimeFormatter"/>
    <for-stereotype stereotype="HORA"/>
    <for-stereotype stereotype="TIME"/>		
  </editor>	
  
  <editor url="textEditor.jsp">
	<formatter class="org.openxava.formatters.SQLTimeFormatter"/>
    <for-type type="java.sql.Time"/>
  </editor>	
  
  <editor url="moneyEditor.jsp">		
    <for-stereotype stereotype="DINERO"/>
	<for-stereotype stereotype="MONEY"/>
  </editor>
    
  <editor url="imageEditor.jsp" format="false">
    <formatter class="org.openxava.formatters.ImageFormatter"/>
    <for-stereotype stereotype="FOTO"/>
	<for-stereotype stereotype="PHOTO"/>		
    <for-stereotype stereotype="IMAGEN"/>
    <for-stereotype stereotype="IMAGE"/>		
  </editor>
  
  <editor url="textAreaEditor.jsp" frame="true">
    <for-stereotype stereotype="TEXTO_GRANDE"/>
		<for-stereotype stereotype="MEMO"/>
		<for-stereotype stereotype="TEXT_AREA"/>
  </editor>
  
  <editor url="labelEditor.jsp">
		<formatter from-type="true"/>		
    <for-stereotype stereotype="ETIQUETA"/>
    <for-stereotype stereotype="LABEL"/>
  </editor>
      
  <editor url="dateTimeCalendarEditor.jsp">
	<formatter class="org.openxava.formatters.DateTimeFormatter"/>
	<for-type type="java.sql.Timestamp"/> 
    <for-stereotype stereotype="DATETIME"/>
    <for-stereotype stereotype="FECHAHORA"/>
  </editor>    
  
  <editor url="boldLabelEditor.jsp">
	<for-stereotype stereotype="ETIQUETA_NEGRITA"/>
    <for-stereotype stereotype="BOLD_LABEL"/>
  </editor>
  
  <editor url="galleryEditor.jsp">
	<for-stereotype stereotype="IMAGES_GALLERY"/>
	<for-stereotype stereotype="GALERIA_IMAGENES"/>
  </editor>
  
   <editor url="textEditor.jsp"> 
   	<property name="fillWithZeros" value="true"/>
	<for-stereotype stereotype="ZEROS_FILLED"/>
	<for-stereotype stereotype="RELLENADO_CON_CEROS"/>
  </editor>
    
  <!-- 
  This steroetype is not for be assigned directly to a property, 
  but it's used internally by OpenXava to render actions inside views.
  -->  
  <editor url="actionEditor.jsp"> 
	<for-stereotype stereotype="__ACTION__"/>
  </editor>
  
  <editor url="htmlEditor.jsp" frame="true">
    <for-stereotype stereotype="HTML_TEXT"/>
    <for-stereotype stereotype="TEXTO_HTML"/>
  </editor>
        
</editors>