<?xml version = "1.0" encoding = "ISO-8859-1"?>

<!DOCTYPE editors SYSTEM "dtds/editors.dtd">

<!-- OpenXavaTest -->

<editors>

  <!-- For work only in uppercase -->	
  <editor url="textEditor.jsp"> 
		<formatter class="org.openxava.formatters.UpperCaseFormatter"/>
    <for-type type="java.lang.String"/>
  </editor>
	
  <editor url="textEditor.jsp"> 
    <for-stereotype stereotype="NO_FORMATING_STRING"/>
  </editor>

  <editor url="textEditor.jsp">
		<formatter class="org.openxava.test.formatters.PersonNameFormatter"> 
			<set property="firstLetterInUpperCase" value="true"/>	
		</formatter>
    <for-stereotype stereotype="PERSON_NAME"/>
  </editor>
	      
  <editor url="textEditor.jsp">
    <for-model-property model="Product" property="unitPrice"/>
  </editor>
      
  <editor url="descriptionsEditor.jsp">
		<property name="model" value="Family"/>
		<property name="keyProperty" value="number"/>
		<property name="descriptionProperty" value="description"/>
		<property name="orderByKey" value="true"/>
		<property name="readOnlyAsLabel" value="true"/>
    <for-stereotype stereotype="FAMILY"/>
  </editor>
      
  <!-- It is possible to specify dependencies from stereotypes or properties -->    
  <editor url="descriptionsEditor.jsp" depends-stereotypes="FAMILY">          
  <!--  
  <editor url="descriptionsEditor.jsp" depends-properties="familyNumber">
  -->	
		<property name="model" value="Subfamily"/>
		<property name="keyProperty" value="number"/>
		<property name="descriptionProperties" value="number, description"/>
		<property name="condition" value="${familyNumber} = ?"/>
		<property name="parameterValuesStereotypes" value="FAMILY"/>	
		<!--
		<property name="parameterValuesProperties" value="familyNumber"/>
		-->		
		<property name="descriptionsFormatter" value="org.openxava.test.formatters.FamilyDescriptionsFormatter"/>	
		<for-stereotype stereotype="SUBFAMILY"/>
  </editor>

  <editor url="descriptionsEditor.jsp" depends-properties="family.number"> 
		<property name="model" value="Subfamily"/>
		<property name="keyProperty" value="number"/>
		<property name="descriptionProperties" value="description"/>
		<property name="condition" value="${familyNumber} = ?"/>
		<property name="parameterValuesProperties" value="family.number"/>
		<for-stereotype stereotype="SUBFAMILY_DEPENDS_REFERENCE"/>
  </editor>
  
  <editor	url="descriptionsEditor.jsp" frame="true">
  	<property name="model" value="Warehouse"/>
  	<property name="keyProperties" value="zoneNumber, number"/>
		<property name="descriptionProperty" value="name"/>
		<property name="filter" value="org.openxava.test.filters.DefaultZoneFilter"/>
		<property name="condition" value="${zoneNumber} = ?"/>
  	<formatter class="org.openxava.test.formatters.WarehouseKeyFormatter"/>	
    <for-stereotype stereotype="WAREHOUSE"/>
  </editor>
	
  <editor url="descriptionsEditor.jsp" depends-properties="family, detail.subfamily">
  	<property name="model" value="ServiceType"/>
  	<property name="keyProperty" value="number"/>
		<property name="descriptionProperty" value="description"/>
		<property name="condition" value="${family} = ? and ${subfamily} = ?"/>
		<property name="parameterValuesProperties" value="family, detail.subfamily"/>
    <for-stereotype stereotype="SERVICE_TYPE"/>
  </editor>
	
  <editor url="descriptionsEditor.jsp" depends-properties="oid">
  	<property name="model" value="Product3"/>
  	<property name="keyProperty" value="number"/>
		<property name="descriptionProperty" value="description"/>
		<property name="condition" value="${family.oid} = ?"/>
		<property name="parameterValuesProperties" value="oid"/>
    <for-stereotype stereotype="PRODUCT3"/>
  </editor>
	
  <editor url="descriptionsEditor.jsp">
  	<property name="model" value="Customer.Receptionist"/>
  	<property name="keyProperty" value="oid"/>
		<property name="descriptionProperty" value="name"/>
    <for-stereotype stereotype="RECEPTIONIST"/>
  </editor>
	        
</editors>
